{
  "schema": "fmea-mining.discriminative-tests.v1",
  "version": "1.3.9",
  "purpose": "Auditar quanto cada um dos seis testes P0 realmente diferencia modos concorrentes; não inferir sensibilidade ou especificidade.",
  "classificationGlossary": {
    "detecta_condicao_sem_isolar_causa": "Evidência direta de uma condição observável, sem identificar causa raiz e sem provar consequência.",
    "detecta_tendencia_sem_atribuir_origem": "Mudança de parâmetro ou contaminante útil para monitorar, mas não isola o componente causador.",
    "detecta_indicio_nao_discriminante": "Sinal inespecífico compartilhado por mecanismos diferentes.",
    "discrimina_desempenho_funcional_condicionado": "Teste de função pode distinguir perda de desempenho sob procedimento OEM e condições controladas; não identifica necessariamente peça interna."
  },
  "policy": {
    "autoDiagnosisForbidden": true,
    "withoutIndependentEvidenceMayBeConfirmed": false,
    "unreviewedRecordsMustRemainProposed": true,
    "noNumericalLikelihoodWithoutEmpiricalValidation": true,
    "confoundersMustBeExplicit": true,
    "alternativesMustRemainOpenByDefault": true
  },
  "counts": {
    "priorityTests": 6,
    "distinctChains": 6
  },
  "records": [
    {
      "id": "DISC-FC-HOSE-001-I1",
      "evidenceRequirementId": "ER-FC-HOSE-001-I1",
      "chainId": "FC-HOSE-001",
      "investigationId": "I1",
      "methodId": "EV-01",
      "targetMode": "Redução da integridade da cobertura/reforço, com possibilidade de perda de contenção",
      "reviewPriority": "P0",
      "scope": "diagnostico_qualitativo_geral_sem_dados_de_campo",
      "discriminativeCapability": "detecta_condicao_sem_isolar_causa",
      "detectedCondition": "Desgaste físico na cobertura nos trechos acessíveis e possível contato com estrutura.",
      "canDiscriminate": "Distingue cobertura com sinais visíveis de abrasão de cobertura sem sinais nos trechos examinados; orienta pontos de fricção e extensão aparente.",
      "cannotDiscriminate": "Não demonstra perda de contenção, falha da união prensada, origem de um vazamento ou integridade dos reforços internos.",
      "confoundingFactors": [
        "Óleo escorrendo de conexão acima da mangueira",
        "Trecho encoberto não inspecionado",
        "Marcas antigas sem progressão ativa",
        "Contato em condição dinâmica não reproduzido"
      ],
      "competingHypothesisAssessments": [
        {
          "hypothesisId": "ALT1",
          "description": "Vazamento na união/conexão sem desgaste estrutural do tubo",
          "remainsPlausibleAfterSingleTest": true,
          "why": "Vazamento na conexão pode coexistir com abrasão superficial; somente localização da origem, em procedimento seguro, reduz a ambiguidade."
        },
        {
          "hypothesisId": "ALT2",
          "description": "Óleo proveniente de outro ponto escorre sobre a mangueira",
          "remainsPlausibleAfterSingleTest": true,
          "why": "Óleo de outro ponto permanece plausível enquanto a trilha da fuga não for rastreada à fonte."
        }
      ],
      "complementaryInvestigations": [
        {
          "methodId": "EV-15",
          "purpose": "Comparar roteamento, suporte e folgas com arranjo documentado para a mangueira identificada.",
          "status": "proposto_nao_executado"
        },
        {
          "methodId": "EV-13",
          "purpose": "Consultar histórico de montagem, substituição e ocorrências anteriores na região.",
          "status": "proposto_nao_executado"
        }
      ],
      "interpretationWhenSupports": "O achado favorece apenas a condição descrita, sob metadados e baseline adequados; não confirma a causa nem exclui alternativas.",
      "interpretationWhenWeakens": "A ausência ou resultado normal na condição examinada reduz plausibilidade localizada; não exclui dano intermitente, oculto ou fora da condição testada.",
      "interpretationWhenInconclusive": "Não ranquear hipóteses quando faltam posição, referência, qualidade amostral, segurança, instrumento ou controle de variáveis.",
      "validationPrerequisites": "Preservar fotos, ponto de contato, trajetória do fluido e documentação de montagem; inspeção visual não justifica teste improvisado com circuito pressurizado.",
      "sourceIds": [
        "CAT-HYD-HOSE-INSPECT",
        "CAT-HYD-HOSE-FAILURE"
      ],
      "resultObserved": null,
      "numericalDiscriminationMetrics": {
        "sensitivity": null,
        "specificity": null,
        "likelihoodRatio": null,
        "confidence": null
      },
      "oemProcedureEffectiveForFleet": false,
      "inspectedActualEquipment": false,
      "reviewStatus": "analise_metodologica_nao_homologada",
      "automaticallyConfirmRootCause": false,
      "automaticallyRejectAlternatives": false
    },
    {
      "id": "DISC-FC-FD-001-I2",
      "evidenceRequirementId": "ER-FC-FD-001-I2",
      "chainId": "FC-FD-001",
      "investigationId": "I2",
      "methodId": "EV-08",
      "targetMode": "Desgaste prematuro por partículas em contato, com potencial degradação de engrenagens ou rolamentos",
      "reviewPriority": "P0",
      "scope": "diagnostico_qualitativo_geral_sem_dados_de_campo",
      "discriminativeCapability": "detecta_tendencia_sem_atribuir_origem",
      "detectedCondition": "Tendência de materiais de desgaste e possíveis contaminantes no lubrificante de um compartimento identificado.",
      "canDiscriminate": "Distingue tendência alterada de condição estável quando produto, ponto, método e tempo de óleo são comparáveis.",
      "cannotDiscriminate": "Não identifica engrenagem ou rolamento causador, e não prova se as partículas são abrasivo que ingressou ou desgaste produzido dentro do redutor.",
      "confoundingFactors": [
        "Mudança autorizada de formulação ou baseline",
        "Coleta contaminada por equipamento ou recipiente",
        "Horas de óleo ou temperatura não comparáveis",
        "Partículas maiores não capturadas pelo método de análise"
      ],
      "competingHypothesisAssessments": [
        {
          "hypothesisId": "ALT1",
          "description": "Desgaste de regime/assentamento sem falha evolutiva comprovada",
          "remainsPlausibleAfterSingleTest": true,
          "why": "Assentamento/depósito de regime permanece possível sem série histórica e exame de partículas."
        },
        {
          "hypothesisId": "ALT2",
          "description": "Partículas produzidas por falha já existente de engrenagem/rolamento",
          "remainsPlausibleAfterSingleTest": true,
          "why": "Dano interno prévio produzindo partículas pode gerar o mesmo laudo; requer morfologia e inspeção convergentes."
        }
      ],
      "complementaryInvestigations": [
        {
          "methodId": "EV-11",
          "purpose": "Analisar depósito de bujão magnético/filtro, morfologia e sua evolução conforme procedimento e rastreio OEM.",
          "status": "proposto_nao_executado"
        },
        {
          "methodId": "EV-10",
          "purpose": "Verificar presença de água/contaminantes por amostra representativa e ensaio pertinente.",
          "status": "proposto_nao_executado"
        }
      ],
      "interpretationWhenSupports": "O achado favorece apenas a condição descrita, sob metadados e baseline adequados; não confirma a causa nem exclui alternativas.",
      "interpretationWhenWeakens": "A ausência ou resultado normal na condição examinada reduz plausibilidade localizada; não exclui dano intermitente, oculto ou fora da condição testada.",
      "interpretationWhenInconclusive": "Não ranquear hipóteses quando faltam posição, referência, qualidade amostral, segurança, instrumento ou controle de variáveis.",
      "validationPrerequisites": "Exigir identificação do compartimento, fluido, amostragem, horas, método laboratorial e histórico; não transportar classes/limites genéricos de bujão a uma série não confirmada.",
      "sourceIds": [
        "CAT-DRIVE-MAGNET-PLUG",
        "SKF-WEAR-SURFACE-FATIGUE",
        "CAT-FLUID-ANALYSIS-101"
      ],
      "resultObserved": null,
      "numericalDiscriminationMetrics": {
        "sensitivity": null,
        "specificity": null,
        "likelihoodRatio": null,
        "confidence": null
      },
      "oemProcedureEffectiveForFleet": false,
      "inspectedActualEquipment": false,
      "reviewStatus": "analise_metodologica_nao_homologada",
      "automaticallyConfirmRootCause": false,
      "automaticallyRejectAlternatives": false
    },
    {
      "id": "DISC-FC-COOL-001-I1",
      "evidenceRequirementId": "ER-FC-COOL-001-I1",
      "chainId": "FC-COOL-001",
      "investigationId": "I1",
      "methodId": "EV-01",
      "targetMode": "Capacidade de rejeição térmica insuficiente pela resistência ao fluxo de ar no pacote de trocadores",
      "reviewPriority": "P0",
      "scope": "diagnostico_qualitativo_geral_sem_dados_de_campo",
      "discriminativeCapability": "detecta_condicao_sem_isolar_causa",
      "detectedCondition": "Acúmulo visível de poeira e detritos nas aletas ou entre módulos de troca térmica.",
      "canDiscriminate": "Distingue passagens externamente sujas de passagens visivelmente limpas na área acessível.",
      "cannotDiscriminate": "Não quantifica redução térmica, não demonstra obstrução interna e não exclui falha de ventilador ou circulação de fluido.",
      "confoundingFactors": [
        "Trocador parcialmente inacessível e sujeira oculta",
        "Obstrução insuficiente para afetar desempenho",
        "Carga e ambiente distintos da queixa de aquecimento",
        "Falha concomitante de ventilação ou termorregulação"
      ],
      "competingHypothesisAssessments": [
        {
          "hypothesisId": "ALT1",
          "description": "Baixo nível ou circulação deficiente de líquido de arrefecimento",
          "remainsPlausibleAfterSingleTest": true,